{
  "design_version": "1.0",
  "campaign_id": "OPT-20261001-266",
  "round_id": "R001",
  "phase": "explore",
  "method": "lhs_fill",
  "trials": [
    {
      "trial_id": "R001-T01",
      "setpoints": {
        "press": 0.636594,
        "temp": 82.922906
      },
      "extrapolation": true,
      "safety_checked": true,
      "selection_reason": "space-filling LHS (exploring); lhs_fill; dup_to_existing=False; nearest_data_coded=inf"
    },
    {
      "trial_id": "R001-T02",
      "setpoints": {
        "press": 0.565735,
        "temp": 87.002834
      },
      "extrapolation": true,
      "safety_checked": true,
      "selection_reason": "space-filling LHS (exploring); lhs_fill; dup_to_existing=False; nearest_data_coded=inf"
    },
    {
      "trial_id": "R001-T03",
      "setpoints": {
        "press": 0.589849,
        "temp": 84.33631
      },
      "extrapolation": true,
      "safety_checked": true,
      "selection_reason": "space-filling LHS (exploring); lhs_fill; dup_to_existing=False; nearest_data_coded=inf"
    },
    {
      "trial_id": "R001-T04",
      "setpoints": {
        "press": 0.645881,
        "temp": 86.422232
      },
      "extrapolation": true,
      "safety_checked": true,
      "selection_reason": "space-filling LHS (exploring); lhs_fill; dup_to_existing=False; nearest_data_coded=inf"
    },
    {
      "trial_id": "R001-T05",
      "setpoints": {
        "press": 0.611833,
        "temp": 84.143598
      },
      "extrapolation": true,
      "safety_checked": true,
      "selection_reason": "space-filling LHS (exploring); lhs_fill; dup_to_existing=False; nearest_data_coded=inf"
    },
    {
      "trial_id": "R001-T06",
      "setpoints": {
        "press": 0.561535,
        "temp": 87.25212
      },
      "extrapolation": true,
      "safety_checked": true,
      "selection_reason": "space-filling LHS (exploring); lhs_fill; dup_to_existing=False; nearest_data_coded=inf"
    },
    {
      "trial_id": "R001-T07",
      "setpoints": {
        "press": 0.586003,
        "temp": 85.4061
      },
      "extrapolation": true,
      "safety_checked": true,
      "selection_reason": "space-filling LHS (exploring); lhs_fill; dup_to_existing=False; nearest_data_coded=inf"
    },
    {
      "trial_id": "R001-T08",
      "setpoints": {
        "press": 0.613304,
        "temp": 82.080138
      },
      "extrapolation": true,
      "safety_checked": true,
      "selection_reason": "space-filling LHS (exploring); lhs_fill; dup_to_existing=False; nearest_data_coded=inf"
    }
  ],
  "model_summary": null,
  "gating": {
    "domain_ok": true,
    "safety_ok": true,
    "duplication_ratio": 0.0
  },
  "provenance": {
    "input_sha256": "379154f3594dd35477820504f8ba566544c72d973facf6137104572c7e683905",
    "script_version": "1.0.0",
    "seed": 11,
    "authored_by": "script"
  }
}